{
  "body": "Three floors, nine rooms, one road in. The mist comes off the fen most evenings and the inn is the only lit thing in it for an hour's walk. That is why people stop here, and why nobody leaves in a hurry.",
  "category": "places",
  "id": "codex_the_mistfall_inn",
  "name": "The Mistfall Inn",
  "tags": [
    "act1"
  ]
}
